id;user_id;category_id;title;content;image_urls;tags;is_pinned;is_qa;like_count;comment_count;created_at;updated_at;is_hidden
d181be03-f4c1-4cf7-80eb-94e7df24f763;5d3284cb-fe10-46b1-bc9a-16b3b3fd228d;c5a4fb69-dad9-4122-b9a8-68797dd05f3d;Bạn đang sử dụng thực phẩm bổ sung nào cho mỗi trận pick ?;"Trên thị trường đang thấy khá nhiều loại TPCN cho dân chơi thể thao như OTE, Đông Trùng Bách Khang.... 
Mọi người đang sử dụng loại nào, chất lượng ra sao?";[];[];false;false;0;0;2026-02-27 07:27:59.15482+00;2026-02-27 07:27:59.15482+00;false
f8b100dc-b8d0-4181-8135-a11b820b3d36;2758b55a-f90f-4bcf-b87c-b6bfd44fc812;c5a4fb69-dad9-4122-b9a8-68797dd05f3d;Joola V giá bao nhiêu;Joola 5 có những phiên bản nào và giá bao nhiêu anh em ?;[];[];false;false;1;3;2026-02-27 07:14:01.23617+00;2026-02-27 08:10:27.818312+00;false
37decda4-fc12-4eb9-b788-10e4df6d7945;5d3284cb-fe10-46b1-bc9a-16b3b3fd228d;6a190ba8-539b-4f45-bbd8-85c3beb3db7b;🔥 Quang Duong Signs New APP Deal — Key Takeaways from His Father’s Podcast with Zane Navratil;"❤️‍🔥 Just a few hours ago, Quang Duong’s father shared some details about Quang Duong’s new contract with the APP during a podcast with Zane Navratil. Here are a few key points from the conversation:

No details were mentioned about salary or the total value of the contract.

Quang Duong is required to play 4 tournaments per year in the U.S. and 4 DJoy events, while the rest of his schedule is flexible — he can compete wherever he wants.

The reason QD did not return to the PPA Tour is that the income there would only be about one-fifth of what he’s making now, while his current deal allows him to travel and compete around the world.

🫡 Quang Duong’s father also said that APP is heading in the right direction and could surpass the PPA within 6 months to a year. At that point, I felt he started rambling a bit, so I stopped listening… because some of you might remember that not long ago he also said pickleball in Asia would grow very quickly, yet in the end QD signed with what many consider the second-tier league in the U.S. 😬

#pickleball";"[""https://nijiwypubmkvmjuafmgp.supabase.co/storage/v1/object/public/forum-images/5d3284cb-fe10-46b1-bc9a-16b3b3fd228d/1772725281914-x6upig.jpeg""]";[];false;false;0;0;2026-03-05 15:41:28.655382+00;2026-03-05 15:41:28.655382+00;false
e8325fc9-bdae-47eb-a2eb-3ccb42ef9955;5d3284cb-fe10-46b1-bc9a-16b3b3fd228d;6a190ba8-539b-4f45-bbd8-85c3beb3db7b;Quick Review: Joola V Kosmos — So Good-Looking It Makes You Forget Other Brands (For a Moment);"Quick Review: Joola V Kosmos – good-looking enough to make you… temporarily forget other brands

Today I got to test the Joola V – Kosmos edition in green, and the very first impression?
The color is absolutely beautiful.

🎨 Looks: seriously impressive

The green color with a monolith-style pattern looks really sharp. The moment you hold it, you can tell Joola’s design team this time actually paid attention to what players want visually. It just feels much more modern when placed next to another paddle.

However… one question remains.
Has Joola fixed the edge guard issue yet?

They probably need to make that clear to users to avoid situations like with the Joola IV, where removing the edge tape could end up peeling the paint underneath. And if that happens again, the real question is: will it be covered under warranty or not?

🎾 On-court feel (for an amateur like me)… it somehow feels like I leveled up

Resets: soft and controlled

Spin: just the right amount

Drives: very solid feeling

The paddle has that nice, slightly heavy and stable feel, with a weight that seems just right to produce clean shots.

I usually hit hook-style topspin drops, and today it oddly felt… perfectly dialed in. Like the paddle just gave me exactly what I needed.";"[""https://nijiwypubmkvmjuafmgp.supabase.co/storage/v1/object/public/forum-images/5d3284cb-fe10-46b1-bc9a-16b3b3fd228d/1772725519901-kadlm.jpeg""]";[];false;false;0;0;2026-03-05 15:45:26.577444+00;2026-03-05 15:45:26.577444+00;false